{
  "correction_record_id": "CPR-FIC-005",
  "correction_id": "COR-FIC-001",
  "portfolio_id": "PORT-FICTIONAL-A",
  "facility_id": "FAC-FIC-004",
  "subject_id": "FAC-FIC-004",
  "fact_path": "facility.access_hours",
  "superseded_assertion_id": "ASSERT-FIC-1001",
  "governing_assertion_id": "ASSERT-FIC-1002",
  "prior_value_or_hash": "24_7",
  "corrected_value_or_hash": "06_00_22_00",
  "reason_code": "source_mismatch",
  "authority_id": "fictional-facility-operations-owner",
  "authority_scope": "access-hour assertion for fictional facility",
  "discovered_at": "2026-08-19T13:00:00Z",
  "effective_at": "2026-08-01T00:00:00Z",
  "recorded_at": "2026-08-19T13:05:00Z",
  "dependency_snapshot_id": "DEP-FIC-029",
  "consumer_id": "fictional-message-774",
  "consumer_class": "communication_or_public_surface",
  "prior_use_state": "already_sent",
  "consequence_class": "high",
  "disposition": "notify",
  "transformation_or_version": "message-template-fic-6",
  "idempotency_key": "IDEM-FIC-COR001-NOTICE",
  "precondition_or_checkpoint": "recipient-scope-approved",
  "execution_state": "authorized",
  "execution_receipt": null,
  "executed_at": null,
  "readback_method": "sent-item plus delivery-state ledger",
  "readback_state": "pending",
  "readback_value_or_hash": "notice-not-yet-sent",
  "rollback_or_compensation": "do not erase original sent record",
  "residual_state": "open",
  "residual_owner": "fictional-communications-owner",
  "next_review_at": "2026-08-20T15:00:00Z",
  "fictional_flag": true,
  "evidence_boundary": "Fictional teaching record; authorization is not send, delivery, receipt, response, or resolution."
}
